{
  "exp_name": null,
  "iteration": 0,
  "objective_summary": null,
  "selected_direction": null,
  "candidate_directions": [],
  "deduplicated_directions": [],
  "modification_plan": null,
  "code_change_summary": null,
  "agentteam": {
    "b1_candidate_review": {
      "status": "not_started",
      "agents": [
        "team-leader",
        "math-theorist",
        "numerical-debugger",
        "flow-arch-reviewer"
      ],
      "team_lifecycle": {
        "required_agents": [
          "team-leader",
          "math-theorist",
          "numerical-debugger",
          "flow-arch-reviewer"
        ],
        "completed_agents": [],
        "all_agents_completed": false,
        "team_leader_finalized": false,
        "team_disbanded": false,
        "disbanded_at": null,
        "polling": {
          "poll_interval_seconds": 60,
          "poll_cron_id": null,
          "missing_agent_queries": [],
          "polling_cancelled": false,
          "polling_cancelled_at": null
        },
        "notes": []
      },
      "summary": null,
      "candidate_count": 0,
      "blocking_issues": []
    },
    "b2_orthogonality_review": {
      "status": "not_started",
      "agent": "orthogonal-direction-scout",
      "agents": [
        "team-leader",
        "orthogonal-direction-scout"
      ],
      "team_lifecycle": {
        "required_agents": [
          "team-leader",
          "orthogonal-direction-scout"
        ],
        "completed_agents": [],
        "all_agents_completed": false,
        "team_leader_finalized": false,
        "team_disbanded": false,
        "disbanded_at": null,
        "polling": {
          "poll_interval_seconds": 60,
          "poll_cron_id": null,
          "missing_agent_queries": [],
          "polling_cancelled": false,
          "polling_cancelled_at": null
        },
        "notes": []
      },
      "summary": null,
      "accepted_candidates": [],
      "rejected_candidates": [],
      "override_reason": null
    },
    "b3_plan_selection": {
      "status": "not_started",
      "agents": [
        "team-leader",
        "math-theorist",
        "numerical-debugger",
        "flow-arch-reviewer"
      ],
      "team_lifecycle": {
        "required_agents": [
          "team-leader",
          "math-theorist",
          "numerical-debugger",
          "flow-arch-reviewer"
        ],
        "completed_agents": [],
        "all_agents_completed": false,
        "team_leader_finalized": false,
        "team_disbanded": false,
        "disbanded_at": null,
        "polling": {
          "poll_interval_seconds": 60,
          "poll_cron_id": null,
          "missing_agent_queries": [],
          "polling_cancelled": false,
          "polling_cancelled_at": null
        },
        "notes": []
      },
      "selected_candidate": null,
      "summary": null,
      "implementation_risks": [],
      "diagnostic_requirements": []
    },
    "f1_evidence_review": {
      "status": "not_started",
      "agents": [
        "team-leader",
        "math-theorist",
        "numerical-debugger",
        "flow-arch-reviewer"
      ],
      "team_lifecycle": {
        "required_agents": [
          "team-leader",
          "math-theorist",
          "numerical-debugger",
          "flow-arch-reviewer"
        ],
        "completed_agents": [],
        "all_agents_completed": false,
        "team_leader_finalized": false,
        "team_disbanded": false,
        "disbanded_at": null,
        "polling": {
          "poll_interval_seconds": 60,
          "poll_cron_id": null,
          "missing_agent_queries": [],
          "polling_cancelled": false,
          "polling_cancelled_at": null
        },
        "notes": []
      },
      "summary": null,
      "verdict": null,
      "missing_evidence": []
    }
  },
  "local_validation": {
    "status": "not_started",
    "commands": [],
    "passed": false,
    "notes": []
  },
  "remote_training": {
    "status": "not_started",
    "server": null,
    "remote_dir": null,
    "train_command": null,
    "cron_id": null,
    "log_path": null,
    "started_at": null,
    "ended_at": null
  },
  "result": {
    "status": "pending",
    "best_val_loss": null,
    "final_val_loss": null,
    "best_epoch": null,
    "is_new_best": false
  },
  "root_cause_analysis": {
    "status": "not_started",
    "agent_votes": [],
    "verdict": null,
    "summary": null
  },
  "updated_at": null
}
